21/09/2020 10:22:28,Hichem,Ben Ameur,hichembenameur2003@gmail.com,19008734,M2 THYP,https://drive.google.com/open?id=1nS5DRMxxm1EIVLwSsAfxHPDOT-6T2wKi,Oui,De bonne qualité,https://github.com/Hichem-ben-ameur,,,Développeur,M1 informatique,Pas besoin,Pas besoin,Pas besoin,Pas besoin,Pas besoin,Pas besoin,Besoin d'approfondissement,Pas besoin,Pas besoin,Besoin d'approfondissement,Besoin d'approfondissement,Pas besoin,Besoin d'approfondissement,Besoin d'approfondissement,Besoin d'approfondissement,Pas besoin,Besoin d'approfondissement,,,,,,,,,Besoin d'approfondissement,Pas besoin,,,je connais bien,je connais bien,je connais bien,je connais bien,je connais un peu,je connais bien,je ne connais pas du tout,je connais un peu,je connais un peu,,je connais un peu,je connais un peu,,,,,,,je ne connais pas du tout,je ne connais pas du tout,je ne connais pas du tout,je ne connais pas du tout,je connais un peu,je connais un peu,je connais un peu,je connais un peu,je connais un peu,je ne connais pas du tout,je ne connais pas du tout,je ne connais pas du tout,je ne connais pas du tout,je ne connais pas du tout,je ne connais pas du tout,je ne connais pas du tout,je ne connais pas du tout,je ne connais pas du tout,je ne connais pas du tout,je connais bien,je connais bien,je ne connais pas du tout,je ne connais pas du tout,je ne connais pas du tout,je ne connais pas du tout,je connais un peu,je connais bien,je connais bien,je ne connais pas du tout,je connais bien,je ne connais pas du tout,je connais un peu,je ne connais pas du tout,je ne connais pas du tout,je ne connais pas du tout,je connais un peu,je ne connais pas du tout,je ne connais pas du tout,je connais un peu,je ne connais pas du tout,je ne connais pas du tout,je connais un peu,je connais bien,je connais un peu,,,je connais bien,je connais bien,je connais bien,je connais un peu,je connais bien,je connais bien,je connais bien,je connais un peu,je ne connais pas du tout,je connais un peu,je connais un peu,je connais un peu,je connais bien,je ne connais pas du tout,je ne connais pas du tout,je connais bien,je ne connais pas du tout,je ne connais pas du tout,je ne connais pas du tout,je ne connais pas du tout,je ne connais pas du tout,je ne connais pas du tout,je connais un peu,je connais un peu,je ne connais pas du tout,je ne connais pas du tout,je ne connais pas du tout,je connais bien,je connais un peu,je connais bien,je ne connais pas du tout,je ne connais pas du tout,je ne connais pas du tout,je ne connais pas du tout,je ne connais pas du tout,je ne connais pas du tout,je ne connais pas du tout,je ne connais pas du tout,je ne connais pas du tout,je connais un peu,je ne connais pas du tout,je ne connais pas du tout,je ne connais pas du tout,je ne connais pas du tout,je ne connais pas du tout,je ne connais pas du tout,je ne connais pas du tout,je ne connais pas du tout,je ne connais pas du tout,je ne connais pas du tout,jamais,souvent,rarement,souvent,rarement,jamais,jamais,jamais,jamais,jamais,jamais,jamais,jamais,jamais,jamais,jamais,jamais,De qualité moyenne,Pas utilisé,Pas utilisé,"Développeur, Ingénieur informatique"
21/09/2020 11:01:00,abdellah,sbai,abdousbai98@gmail.com,20015178,M2 THYP,https://drive.google.com/open?id=1fmRAg1veqsdCbivEiryo8qw5sXu5AM1k,Oui,De mauvaise qualité,abdousbai98@gmail.com,abdousbai98@gmail.com,,Développeur,master informatique,Besoin d'approfondissement,Besoin d'approfondissement,Pas besoin,Besoin d'approfondissement,Besoin d'approfondissement,Pas besoin,Pas besoin,Pas besoin,Pas besoin,Pas besoin,Pas besoin,Pas besoin,Pas besoin,Besoin d'approfondissement,Pas besoin,Besoin d'approfondissement,Pas besoin,Pas besoin,Pas besoin,Pas besoin,Besoin d'approfondissement,Besoin d'approfondissement,Besoin d'approfondissement,Besoin d'approfondissement,Pas besoin,Besoin urgent,Besoin urgent,Pas besoin,Pas besoin,je connais bien,je connais bien,je ne connais pas du tout,je connais un peu,je ne connais pas du tout,je ne connais pas du tout,je ne connais pas du tout,je ne connais pas du tout,je ne connais pas du tout,je ne connais pas du tout,je ne connais pas du tout,je ne connais pas du tout,je ne connais pas du tout,je ne connais pas du tout,je ne connais pas du tout,je connais bien,je ne connais pas du tout,je ne connais pas du tout,je ne connais pas du tout,je ne connais pas du tout,je ne connais pas du tout,je ne connais pas du tout,je connais bien,je connais bien,je ne connais pas du tout,,je connais bien,je ne connais pas du tout,je ne connais pas du tout,je connais un peu,je ne connais pas du tout,je ne connais pas du tout,je ne connais pas du tout,je ne connais pas du tout,je ne connais pas du tout,je ne connais pas du tout,je ne connais pas du tout,je connais bien,je ne connais pas du tout,je ne connais pas du tout,je ne connais pas du tout,je ne connais pas du tout,je ne connais pas du tout,je ne connais pas du tout,je connais bien,je connais bien,je connais bien,je connais bien,je connais bien,je ne connais pas du tout,je ne connais pas du tout,je ne connais pas du tout,je connais bien,je connais bien,je ne connais pas du tout,je ne connais pas du tout,,je ne connais pas du tout,je ne connais pas du tout,je connais un peu,je ne connais pas du tout,je ne connais pas du tout,je ne connais pas du tout,je connais bien,je connais bien,je connais un peu,je ne connais pas du tout,je ne connais pas du tout,je connais bien,je connais bien,je connais bien,je connais bien,je connais bien,je connais bien,je connais bien,je connais bien,je connais bien,je ne connais pas du tout,je ne connais pas du tout,je connais bien,je connais bien,je ne connais pas du tout,je ne connais pas du tout,je ne connais pas du tout,je ne connais pas du tout,je ne connais pas du tout,je connais bien,je ne connais pas du tout,je ne connais pas du tout,je ne connais pas du tout,je ne connais pas du tout,je connais bien,je connais un peu,je connais bien,je ne connais pas du tout,je ne connais pas du tout,je ne connais pas du tout,je ne connais pas du tout,je ne connais pas du tout,je ne connais pas du tout,je ne connais pas du tout,je ne connais pas du tout,je ne connais pas du tout,je connais bien,je ne connais pas du tout,je ne connais pas du tout,je ne connais pas du tout,je ne connais pas du tout,je ne connais pas du tout,je ne connais pas du tout,je ne connais pas du tout,je ne connais pas du tout,je ne connais pas du tout,je ne connais pas du tout,souvent,souvent,jamais,souvent,souvent,jamais,souvent,jamais,jamais,souvent,,jamais,jamais,souvent,jamais,jamais,jamais,De qualité moyenne,Pas utilisé,Pas utilisé,Développeur
21/09/2020 13:23:38,chafia,ifrene,chafiaifrene@outlook.fr,16701396,M2 THYP,https://drive.google.com/open?id=1cbNHGGPkNfVsv8QAbWmQLlgPtvNVSjPb,Oui,Pas utilisé,chafiaifrene,,,Développeur,,Besoin d'approfondissement,Besoin d'approfondissement,Besoin d'approfondissement,Besoin d'approfondissement,Besoin d'approfondissement,Besoin d'approfondissement,,Besoin d'approfondissement,Besoin d'approfondissement,Besoin d'approfondissement,Besoin d'approfondissement,Besoin d'approfondissement,Besoin d'approfondissement,Besoin d'approfondissement,Besoin d'approfondissement,Pas besoin,Besoin d'approfondissement,Besoin d'approfondissement,Besoin d'approfondissement,Besoin d'approfondissement,Besoin d'approfondissement,Besoin d'approfondissement,Besoin d'approfondissement,Besoin d'approfondissement,,Besoin d'approfondissement,Besoin d'approfondissement,Besoin d'approfondissement,Besoin d'approfondissement,je connais bien,je connais un peu,je ne connais pas du tout,je ne connais pas du tout,je ne connais pas du tout,je ne connais pas du tout,je ne connais pas du tout,je ne connais pas du tout,,je ne connais pas du tout,je connais un peu,je connais un peu,je connais un peu,je ne connais pas du tout,je ne connais pas du tout,je ne connais pas du tout,,je ne connais pas du tout,je ne connais pas du tout,je ne connais pas du tout,je ne connais pas du tout,je ne connais pas du tout,je connais un peu,je connais un peu,je ne connais pas du tout,je connais un peu,je connais un peu,je ne connais pas du tout,je ne connais pas du tout,je connais bien,je ne connais pas du tout,je connais un peu,je ne connais pas du tout,je ne connais pas du tout,je ne connais pas du tout,je ne connais pas du tout,je ne connais pas du tout,je connais un peu,je connais bien,je ne connais pas du tout,,je ne connais pas du tout,je ne connais pas du tout,je connais un peu,je ne connais pas du tout,,je ne connais pas du tout,je connais un peu,je connais un peu,je ne connais pas du tout,,,je ne connais pas du tout,je connais un peu,je ne connais pas du tout,je ne connais pas du tout,je ne connais pas du tout,je ne connais pas du tout,je ne connais pas du tout,je connais bien,je ne connais pas du tout,je ne connais pas du tout,je connais bien,je ne connais pas du tout,je connais bien,je connais bien,je ne connais pas du tout,je ne connais pas du tout,je connais un peu,je connais un peu,je connais un peu,je connais un peu,je ne connais pas du tout,je ne connais pas du tout,je ne connais pas du tout,je connais un peu,je connais bien,je connais un peu,je ne connais pas du tout,je connais un peu,je connais bien,je ne connais pas du tout,je connais bien,je ne connais pas du tout,je ne connais pas du tout,je ne connais pas du tout,je connais bien,je connais un peu,je ne connais pas du tout,je ne connais pas du tout,je ne connais pas du tout,je connais bien,je connais un peu,je suis expert(e),je ne connais pas du tout,je suis expert(e),je ne connais pas du tout,je ne connais pas du tout,je ne connais pas du tout,je ne connais pas du tout,je ne connais pas du tout,je ne connais pas du tout,je ne connais pas du tout,je connais un peu,je ne connais pas du tout,je connais un peu,je ne connais pas du tout,je ne connais pas du tout,je ne connais pas du tout,je connais bien,je ne connais pas du tout,je ne connais pas du tout,je ne connais pas du tout,je ne connais pas du tout,souvent,jamais,souvent,je suis accro,souvent,jamais,rarement,rarement,jamais,jamais,souvent,jamais,jamais,jamais,jamais,jamais,jamais,De qualité moyenne,Pas utilisé,Pas utilisé,Développeur
21/09/2020 17:52:25,El Mehdi,El BRIDI,mehdibridi@outlook.com,20014722,M2 THYP,https://drive.google.com/open?id=1JJINLUWG0hehAL_LhHYtsR4UVa7fBLJb,Oui,De qualité moyenne,mehdibridi,,mehdibridi,"Développeur, Concepteur",,Besoin d'approfondissement,Pas besoin,Besoin urgent,Besoin d'approfondissement,Besoin urgent,Besoin urgent,Besoin urgent,Besoin d'approfondissement,Besoin urgent,Besoin d'approfondissement,Besoin d'approfondissement,Besoin urgent,,Besoin d'approfondissement,Besoin urgent,Besoin urgent,Besoin urgent,Besoin urgent,Besoin urgent,Besoin urgent,Besoin urgent,Besoin urgent,Besoin d'approfondissement,Besoin d'approfondissement,Besoin urgent,Besoin d'approfondissement,Besoin d'approfondissement,Besoin urgent,Besoin urgent,je connais bien,je connais bien,je ne connais pas du tout,je connais un peu,je ne connais pas du tout,je connais un peu,,je ne connais pas du tout,je ne connais pas du tout,je connais bien,je connais un peu,je ne connais pas du tout,je ne connais pas du tout,je ne connais pas du tout,je ne connais pas du tout,je ne connais pas du tout,je ne connais pas du tout,je ne connais pas du tout,je ne connais pas du tout,je ne connais pas du tout,je ne connais pas du tout,je ne connais pas du tout,je connais bien,je connais bien,je ne connais pas du tout,je connais bien,je connais un peu,je ne connais pas du tout,je ne connais pas du tout,je ne connais pas du tout,je ne connais pas du tout,je ne connais pas du tout,je ne connais pas du tout,,je ne connais pas du tout,je ne connais pas du tout,je ne connais pas du tout,je connais bien,je connais bien,je ne connais pas du tout,je ne connais pas du tout,je ne connais pas du tout,je ne connais pas du tout,je ne connais pas du tout,je connais bien,je connais bien,je ne connais pas du tout,je connais bien,je connais bien,je ne connais pas du tout,je ne connais pas du tout,je ne connais pas du tout,je connais bien,je connais bien,je ne connais pas du tout,je ne connais pas du tout,je connais bien,je ne connais pas du tout,je ne connais pas du tout,je connais bien,je ne connais pas du tout,je ne connais pas du tout,je ne connais pas du tout,je connais bien,je connais bien,je connais bien,je ne connais pas du tout,je ne connais pas du tout,je connais un peu,je connais bien,je connais bien,je connais bien,je connais bien,je connais bien,je connais un peu,je connais bien,je connais bien,,je ne connais pas du tout,je connais bien,je connais bien,je ne connais pas du tout,,je ne connais pas du tout,je ne connais pas du tout,je ne connais pas du tout,je connais bien,je connais bien,je ne connais pas du tout,je ne connais pas du tout,je ne connais pas du tout,je connais bien,je connais bien,je connais bien,,,,,,,,,,je ne connais pas du tout,je ne connais pas du tout,je ne connais pas du tout,,je ne connais pas du tout,je ne connais pas du tout,je ne connais pas du tout,je ne connais pas du tout,je ne connais pas du tout,,je ne connais pas du tout,souvent,rarement,jamais,je suis accro,souvent,jamais,souvent,rarement,rarement,jamais,souvent,jamais,jamais,rarement,rarement,jamais,jamais,De qualité moyenne,Pas utilisé,Pas utilisé,"Développeur, Concepteur"
21/09/2020 20:54:58,Kamal,EL KADI,elkadikamal2@gmail.com,20009424,M2 THYP,https://drive.google.com/open?id=1OpgFHNWmy6M9fLFdbrOCTZ8_S2UTCHO7,Oui,De bonne qualité,KamalELKADI,elkadikamal2,,"Développeur, Concepteur, Chef de projet, Ingénieur informatique",Informatique,Besoin d'approfondissement,Besoin d'approfondissement,Besoin d'approfondissement,Besoin d'approfondissement,Besoin d'approfondissement,Besoin d'approfondissement,Besoin d'approfondissement,Besoin d'approfondissement,Besoin d'approfondissement,Besoin d'approfondissement,Besoin d'approfondissement,Besoin d'approfondissement,Besoin d'approfondissement,Besoin d'approfondissement,Besoin d'approfondissement,Besoin d'approfondissement,Besoin d'approfondissement,Besoin d'approfondissement,Besoin d'approfondissement,Besoin d'approfondissement,Besoin d'approfondissement,Besoin d'approfondissement,Besoin d'approfondissement,Besoin d'approfondissement,Besoin d'approfondissement,Besoin urgent,Besoin d'approfondissement,Besoin urgent,Besoin urgent,je connais bien,je connais bien,je ne connais pas du tout,je connais un peu,je connais un peu,je connais un peu,je ne connais pas du tout,je connais un peu,je connais un peu,je connais un peu,je connais un peu,je ne connais pas du tout,je ne connais pas du tout,je ne connais pas du tout,je ne connais pas du tout,je connais un peu,je connais un peu,je connais un peu,je ne connais pas du tout,je connais un peu,je ne connais pas du tout,je ne connais pas du tout,je connais un peu,je connais bien,je connais un peu,je connais un peu,je connais un peu,je ne connais pas du tout,je ne connais pas du tout,je connais un peu,,,,,,,,je connais bien,je connais bien,je ne connais pas du tout,je ne connais pas du tout,je ne connais pas du tout,je ne connais pas du tout,je connais un peu,je connais bien,je connais bien,je ne connais pas du tout,je connais bien,je connais bien,je ne connais pas du tout,je ne connais pas du tout,je ne connais pas du tout,je ne connais pas du tout,je connais un peu,je connais un peu,je connais un peu,je connais un peu,je connais un peu,je ne connais pas du tout,je connais bien,je ne connais pas du tout,je ne connais pas du tout,je ne connais pas du tout,je connais un peu,je connais bien,je connais bien,je connais bien,,je connais bien,je connais bien,je connais bien,je connais bien,je connais bien,je connais bien,je connais bien,je connais bien,je connais bien,je ne connais pas du tout,je ne connais pas du tout,je connais bien,je connais un peu,je ne connais pas du tout,je ne connais pas du tout,je ne connais pas du tout,je ne connais pas du tout,je connais un peu,je connais un peu,je connais un peu,je ne connais pas du tout,je ne connais pas du tout,je ne connais pas du tout,je connais bien,je connais bien,je connais bien,je connais un peu,je connais un peu,je ne connais pas du tout,je ne connais pas du tout,je ne connais pas du tout,je ne connais pas du tout,je ne connais pas du tout,je ne connais pas du tout,je ne connais pas du tout,je connais un peu,je ne connais pas du tout,je connais un peu,je ne connais pas du tout,je ne connais pas du tout,je ne connais pas du tout,je ne connais pas du tout,je ne connais pas du tout,je ne connais pas du tout,je ne connais pas du tout,je ne connais pas du tout,souvent,rarement,je suis accro,rarement,je suis accro,jamais,jamais,souvent,jamais,jamais,souvent,jamais,rarement,rarement,jamais,jamais,jamais,De bonne qualité,,,"Développeur, Concepteur, Chef de projet, Ingénieur informatique"
21/09/2020 21:32:13,Sabrina,BOUSSAD,sabrinaboussad1982@gmail.com,18910736,M2 THYP,https://drive.google.com/open?id=1-ZUaBjXDShV9eAU8FHXXBbb9iEimqfOY,Oui,,BoussadSabi,,,"Développeur, Concepteur, Ingénieur informatique",Master 1 Informatique ,Besoin d'approfondissement,Besoin d'approfondissement,Besoin d'approfondissement,Besoin d'approfondissement,Besoin d'approfondissement,Besoin d'approfondissement,,Besoin d'approfondissement,Besoin d'approfondissement,Besoin d'approfondissement,Besoin d'approfondissement,Besoin d'approfondissement,,Besoin d'approfondissement,,Besoin d'approfondissement,Besoin d'approfondissement,Besoin d'approfondissement,,Besoin d'approfondissement,,,Besoin d'approfondissement,Besoin d'approfondissement,,Besoin d'approfondissement,Besoin d'approfondissement,,,je connais un peu,je connais bien,je connais un peu,je connais bien,je connais un peu,je connais un peu,je ne connais pas du tout,je ne connais pas du tout,je ne connais pas du tout,je ne connais pas du tout,je ne connais pas du tout,je connais un peu,je ne connais pas du tout,je connais un peu,je ne connais pas du tout,je connais un peu,je ne connais pas du tout,je connais un peu,je ne connais pas du tout,je connais un peu,je ne connais pas du tout,je ne connais pas du tout,je connais un peu,je connais un peu,je ne connais pas du tout,je connais un peu,je ne connais pas du tout,je ne connais pas du tout,je ne connais pas du tout,je connais un peu,je connais un peu,je ne connais pas du tout,je ne connais pas du tout,je connais un peu,je ne connais pas du tout,je ne connais pas du tout,je ne connais pas du tout,je connais un peu,je connais bien,je ne connais pas du tout,je ne connais pas du tout,je ne connais pas du tout,je ne connais pas du tout,je ne connais pas du tout,je connais bien,je ne connais pas du tout,je ne connais pas du tout,je connais bien,je ne connais pas du tout,je ne connais pas du tout,je connais bien,je ne connais pas du tout,je ne connais pas du tout,je connais un peu,je ne connais pas du tout,je ne connais pas du tout,je ne connais pas du tout,je ne connais pas du tout,je ne connais pas du tout,je ne connais pas du tout,je ne connais pas du tout,je connais un peu,je connais bien,je connais un peu,je ne connais pas du tout,je connais bien,je suis expert(e),je connais bien,je connais un peu,je connais bien,je connais bien,je connais un peu,je connais un peu,je connais un peu,je connais un peu,je connais un peu,je connais bien,je ne connais pas du tout,je ne connais pas du tout,je connais bien,je connais un peu,je ne connais pas du tout,je connais bien,je ne connais pas du tout,je ne connais pas du tout,je ne connais pas du tout,je connais un peu,je connais un peu,je ne connais pas du tout,je ne connais pas du tout,je ne connais pas du tout,je connais bien,je connais un peu,je connais bien,je ne connais pas du tout,je connais bien,je ne connais pas du tout,je ne connais pas du tout,je ne connais pas du tout,je ne connais pas du tout,je ne connais pas du tout,je ne connais pas du tout,je ne connais pas du tout,je connais bien,je ne connais pas du tout,je ne connais pas du tout,je ne connais pas du tout,je ne connais pas du tout,je ne connais pas du tout,je connais un peu,je ne connais pas du tout,je ne connais pas du tout,je connais un peu,je ne connais pas du tout,souvent,jamais,souvent,rarement,rarement,jamais,rarement,jamais,jamais,jamais,souvent,rarement,jamais,rarement,rarement,jamais,rarement,De bonne qualité,,,"Graphiste, Développeur, Concepteur, Chef de projet, Banques, Assurances"
21/09/2020 22:11:13,maroua,jellal,marouajellal788@gmail.com,pas encore inscrite,M2 THYP,https://drive.google.com/open?id=1MQaSFmm3w0Ns4CduBGpvaSYkoVnNBooU,Oui,De qualité moyenne,marouajellal,,,"Développeur, Concepteur, Ingénieur informatique",Ingenieur en systemes d'information et aide a la decision,Pas besoin,Pas besoin,Pas besoin,Pas besoin,Pas besoin,Besoin urgent,Besoin d'approfondissement,Besoin d'approfondissement,Besoin d'approfondissement,Besoin d'approfondissement,Besoin d'approfondissement,Besoin urgent,Besoin d'approfondissement,Besoin d'approfondissement,Besoin d'approfondissement,Besoin urgent,Besoin d'approfondissement,Besoin urgent,Besoin d'approfondissement,Besoin urgent,Besoin d'approfondissement,Besoin d'approfondissement,Pas besoin,Pas besoin,Besoin d'approfondissement,Besoin d'approfondissement,Besoin d'approfondissement,Besoin urgent,Besoin urgent,je suis expert(e),je suis expert(e),je suis expert(e),je suis expert(e),je suis expert(e),je ne connais pas du tout,je ne connais pas du tout,je connais bien,je ne connais pas du tout,je connais un peu,je ne connais pas du tout,je ne connais pas du tout,je ne connais pas du tout,je connais un peu,je ne connais pas du tout,je connais un peu,je connais un peu,je ne connais pas du tout,je ne connais pas du tout,je ne connais pas du tout,je connais un peu,je ne connais pas du tout,je connais bien,je connais bien,je connais bien,je connais bien,je connais bien,je connais un peu,je connais un peu,je ne connais pas du tout,je ne connais pas du tout,je ne connais pas du tout,je ne connais pas du tout,je ne connais pas du tout,je ne connais pas du tout,je ne connais pas du tout,je ne connais pas du tout,je connais bien,je connais bien,je ne connais pas du tout,je ne connais pas du tout,,je ne connais pas du tout,je ne connais pas du tout,je connais bien,je connais bien,je ne connais pas du tout,je connais bien,je ne connais pas du tout,je connais un peu,je ne connais pas du tout,je ne connais pas du tout,je ne connais pas du tout,je connais un peu,je ne connais pas du tout,je ne connais pas du tout,je ne connais pas du tout,je ne connais pas du tout,je connais un peu,je connais bien,je connais un peu,je connais bien,je ne connais pas du tout,je connais un peu,je connais bien,je connais bien,je ne connais pas du tout,je connais un peu,je connais bien,je suis expert(e),je suis expert(e),je connais bien,je ne connais pas du tout,je ne connais pas du tout,je connais un peu,je connais bien,je connais bien,je ne connais pas du tout,je ne connais pas du tout,je connais bien,je ne connais pas du tout,je ne connais pas du tout,je ne connais pas du tout,je ne connais pas du tout,je ne connais pas du tout,je ne connais pas du tout,je ne connais pas du tout,je connais bien,je ne connais pas du tout,je ne connais pas du tout,je ne connais pas du tout,je connais bien,je connais bien,je suis expert(e),je connais un peu,,,,,,,,,je connais un peu,je ne connais pas du tout,je ne connais pas du tout,je ne connais pas du tout,je ne connais pas du tout,je ne connais pas du tout,je connais un peu,je ne connais pas du tout,je ne connais pas du tout,je ne connais pas du tout,je ne connais pas du tout,souvent,jamais,souvent,souvent,souvent,jamais,rarement,,jamais,jamais,je suis accro,jamais,jamais,jamais,jamais,jamais,jamais,De qualité moyenne,Pas utilisé,Pas utilisé,Chef de projet
